{
  "specVersion": "0.1",
  "id": "plan-sso",
  "revision": 1,
  "project": { "id": "customer-platform" },
  "title": "Corporate SSO",
  "intent": "Internal users authenticate through corporate SSO.",
  "outcomes": [
    { "id": "sso", "title": "Corporate users authenticate with SSO." }
  ],
  "acceptanceCriteria": [
    { "id": "ac-1", "outcomeId": "sso", "statement": "SSO login succeeds." }
  ]
}
