{
  "specVersion": "0.1",
  "id": "plan-minimal",
  "revision": 1,
  "project": { "id": "example-project" },
  "title": "Example plan",
  "intent": "Describe one durable planning intent.",
  "outcomes": [
    {
      "id": "outcome-pending",
      "title": "One bounded example outcome."
    }
  ],
  "acceptanceCriteria": []
}
